[
  {
    "widget_type": "bot_text",
    "variant": "default",
    "payload": {
      "text": "Hello from Muno",
      "timestamp": "2026-05-13T00:00:00Z",
      "markdown": true
    },
    "schema_version": 1,
    "ai_adjustments": {
      "annotations": [
        {
          "target": "widget",
          "text": "sample"
        }
      ]
    }
  },
  {
    "widget_type": "user_text",
    "variant": "default",
    "payload": {
      "text": "Find flights to Paris",
      "timestamp": "2026-05-13T00:00:01Z",
      "user_avatar_url": "https://example.com/avatar.png"
    },
    "schema_version": 1,
    "ai_adjustments": {
      "annotations": [
        {
          "target": "widget",
          "text": "sample"
        }
      ]
    }
  },
  {
    "widget_type": "typing_indicator",
    "variant": "default",
    "payload": {
      "agent_name": "Muno"
    },
    "schema_version": 1,
    "ai_adjustments": {
      "annotations": [
        {
          "target": "widget",
          "text": "sample"
        }
      ]
    }
  },
  {
    "widget_type": "date_range_picker",
    "variant": "compact",
    "payload": {
      "min_date": "2026-06-01",
      "max_date": "2026-12-31",
      "default_from": "2026-07-01",
      "default_to": "2026-07-05",
      "locale": "en",
      "submit": "submit",
      "submitted_value": {
        "from": "2026-07-01",
        "to": "2026-07-05",
        "nights": 4
      }
    },
    "schema_version": 1,
    "ai_adjustments": {
      "annotations": [
        {
          "target": "widget",
          "text": "sample"
        }
      ]
    }
  },
  {
    "widget_type": "party_picker",
    "variant": "default",
    "payload": {
      "rooms_max": 4,
      "adults_max": 6,
      "children_max": 4,
      "allow_child_ages": true,
      "submitted_value": {
        "rooms": 1,
        "adults": 2,
        "children": [
          {
            "age": 8
          }
        ]
      }
    },
    "schema_version": 1,
    "ai_adjustments": {
      "annotations": [
        {
          "target": "widget",
          "text": "sample"
        }
      ]
    }
  },
  {
    "widget_type": "place_autocomplete_input",
    "variant": "default",
    "payload": {
      "placeholder": "Where to?",
      "suggestions": [
        {
          "label": "Paris",
          "id": "PAR",
          "kind": "city"
        }
      ],
      "submit_on_select": true,
      "submitted_value": {
        "label": "Paris",
        "id": "PAR",
        "kind": "city"
      }
    },
    "schema_version": 1,
    "ai_adjustments": {
      "annotations": [
        {
          "target": "widget",
          "text": "sample"
        }
      ]
    }
  },
  {
    "widget_type": "flight_list",
    "variant": "default",
    "payload": {
      "title": "Flights",
      "items": [
        {
          "offer_id": "off_123",
          "price": {
            "total": "199.00",
            "currency": "USD"
          },
          "itineraries": [
            {
              "duration": "PT6H",
              "segments": [
                {
                  "departure": {
                    "iata": "SFO",
                    "at": "2026-07-15T08:00:00"
                  },
                  "arrival": {
                    "iata": "JFK",
                    "at": "2026-07-15T16:30:00"
                  },
                  "carrier": "UA",
                  "flight_number": "100",
                  "duration": "PT5H30M",
                  "stops": 0
                }
              ]
            }
          ],
          "carriers": [
            "UA"
          ],
          "duration": "PT6H",
          "stops": 0,
          "validating_airline": "UA",
          "ctas": [
            "view_details",
            "book_this"
          ],
          "ai_adjustments": {
            "emphasis": "cheapest",
            "annotations": [
              {
                "target": "price",
                "text": "Good value",
                "kind": "success"
              }
            ]
          }
        }
      ],
      "emphasis_offer_id": "off_123",
      "total_count": 1,
      "currency": "USD"
    },
    "schema_version": 1,
    "ai_adjustments": {
      "annotations": [
        {
          "target": "widget",
          "text": "sample"
        }
      ]
    }
  },
  {
    "widget_type": "flight_card",
    "variant": "compact",
    "payload": {
      "offer_id": "off_123",
      "price": {
        "total": "199.00",
        "currency": "USD"
      },
      "itineraries": [
        {
          "duration": "PT6H",
          "segments": [
            {
              "departure": {
                "iata": "SFO",
                "at": "2026-07-15T08:00:00"
              },
              "arrival": {
                "iata": "JFK",
                "at": "2026-07-15T16:30:00"
              },
              "carrier": "UA",
              "flight_number": "100",
              "duration": "PT5H30M",
              "stops": 0
            }
          ]
        }
      ],
      "carriers": [
        "UA"
      ],
      "duration": "PT6H",
      "stops": 0,
      "validating_airline": "UA",
      "ctas": [
        "view_details",
        "book_this"
      ],
      "ai_adjustments": {
        "emphasis": "cheapest",
        "annotations": [
          {
            "target": "price",
            "text": "Good value",
            "kind": "success"
          }
        ]
      }
    },
    "schema_version": 1,
    "ai_adjustments": {
      "annotations": [
        {
          "target": "widget",
          "text": "sample"
        }
      ]
    }
  },
  {
    "widget_type": "flight_card",
    "variant": "full",
    "payload": {
      "offer_id": "off_JFK_0",
      "direction": "outbound",
      "price": {
        "total": "220.00",
        "currency": "USD",
        "base": "180.00",
        "tax": "40.00"
      },
      "itineraries": [
        {
          "direction": "outbound",
          "origin": {
            "iata": "JFK",
            "at": "",
            "city": "New York",
            "airport_name": "John F. Kennedy International Airport",
            "terminal": ""
          },
          "destination": {
            "iata": "MCO",
            "at": "",
            "city": "Orlando",
            "airport_name": "Orlando International Airport",
            "terminal": ""
          },
          "duration": "PT6H",
          "stops": 1,
          "segments": [
            {
              "departure": {
                "iata": "JFK",
                "at": "2026-11-02T08:15:00",
                "city": "New York",
                "airport_name": "John F. Kennedy International Airport",
                "terminal": "4"
              },
              "arrival": {
                "iata": "MIA",
                "at": "2026-11-02T11:40:00",
                "city": "Miami",
                "airport_name": "Miami International Airport",
                "terminal": "N"
              },
              "carrier": "AA",
              "carrier_name": "American Airlines",
              "airline": {
                "iata_code": "AA",
                "name": "American Airlines",
                "logo_symbol_url": "https://assets.duffel.com/img/airlines/for-light-background/full-color-icon/AA.svg",
                "logo_lockup_url": "https://assets.duffel.com/img/airlines/for-light-background/full-color-logo/AA.svg"
              },
              "flight_number": "1423",
              "duration": "PT3H25M",
              "aircraft": {
                "iata_code": "738",
                "name": "Boeing 737-800"
              },
              "cabin_class": "economy",
              "stops": 0,
              "technical_stops": [],
              "operating_carrier": "MQ",
              "operating_carrier_name": "Envoy Air",
              "operating_airline": {
                "iata_code": "MQ",
                "name": "Envoy Air",
                "logo_symbol_url": "https://assets.duffel.com/img/airlines/for-light-background/full-color-icon/MQ.svg",
                "logo_lockup_url": ""
              },
              "operating_flight_number": "3521"
            },
            {
              "departure": {
                "iata": "MIA",
                "at": "2026-11-02T12:40:00",
                "city": "Miami",
                "airport_name": "Miami International Airport",
                "terminal": "4"
              },
              "arrival": {
                "iata": "MCO",
                "at": "2026-11-02T14:05:00",
                "city": "Orlando",
                "airport_name": "Orlando International Airport",
                "terminal": "N"
              },
              "carrier": "AA",
              "carrier_name": "American Airlines",
              "airline": {
                "iata_code": "AA",
                "name": "American Airlines",
                "logo_symbol_url": "https://assets.duffel.com/img/airlines/for-light-background/full-color-icon/AA.svg",
                "logo_lockup_url": "https://assets.duffel.com/img/airlines/for-light-background/full-color-logo/AA.svg"
              },
              "flight_number": "2201",
              "duration": "PT3H25M",
              "aircraft": {
                "iata_code": "738",
                "name": "Boeing 737-800"
              },
              "cabin_class": "economy",
              "stops": 1,
              "technical_stops": [
                {
                  "airport": {
                    "iataCode": "FLL",
                    "iata": "FLL",
                    "airport_name": "Fort Lauderdale",
                    "city": "",
                    "city_iata": "",
                    "country_code": "",
                    "time_zone": "",
                    "type": ""
                  },
                  "arriving_at": "x",
                  "departing_at": "y",
                  "duration": "PT1H"
                }
              ],
              "operating_carrier": "MQ",